{
  "lessonId": "equity-06",
  "moduleId": "equity",
  "moduleTitle": "Equity and Trusts",
  "lessonNumber": 6,
  "topicId": "equity.wills.secret-trusts",
  "title": "Secret Trusts",
  "subtitle": "The unwritten promise a will was never meant to reveal",
  "estimatedMinutes": 18,
  "itemCounts": {
    "lecture": 5,
    "testPool": 14,
    "testServedPerAttempt": 4
  },
  "objectives": [
    "Explain why a secret trust can be enforced despite apparently failing to comply with the Wills Act 1837, s 9",
    "State and apply the requirements for a fully secret trust, including the rule on when communication and acceptance may occur",
    "Distinguish a half-secret trust from a fully secret trust, and identify the stricter timing rule that governs communication of a half-secret trust's terms",
    "Describe, and hold in tension, the two competing theoretical justifications for secret trusts — the fraud theory and the 'dehors the will' theory — and recognise that neither is uncontested"
  ],
  "leadingAuthorities": [
    {
      "citation": "Ottaway v Norman [1972] Ch 698",
      "role": "Sets out the modern three-element test for a fully secret trust: intention, communication, acceptance"
    },
    {
      "citation": "Blackwell v Blackwell [1929] AC 318",
      "role": "Confirms half-secret trusts are enforceable, and that communication of the terms must occur before or at the execution of the will"
    },
    {
      "citation": "Re Keen [1937] Ch 236",
      "role": "A half-secret trust fails where the will's own wording is inconsistent with the timing or manner of the communication actually given"
    },
    {
      "citation": "Wills Act 1837, s 9",
      "role": "Sets the formalities (writing, signature, attestation by two witnesses) that a valid will must satisfy — the backdrop the secret trust doctrine appears to sidestep"
    }
  ],
  "whyThisMattersTemplate": {
    "default": "Secret trusts sit in an odd corner of the syllabus — equity enforcing a promise that was, by design, kept off the face of a formally executed will. Where the profile shows application is ahead of understanding, this note appears: 'You can already apply the communication and acceptance rules — this lesson asks you to sit with why the doctrine exists at all, since the theoretical justification is genuinely contested, not settled.'",
    "profileHooks": {
      "weakApplication": "The rules here reward precision on timing — read Parts 2 and 3 slowly, since fully secret and half-secret trusts are governed by different communication deadlines, and that's where most marks are lost.",
      "weakKnowledge": "Start with Part 1's framing question before the case detail arrives — understanding why this doctrine needs a justification at all will make the rest of the lesson make sense, rather than feel like an arbitrary list of exceptions."
    }
  },
  "lawStatedAt": "2026-09-01",
  "reviewedBy": null,
  "contentVersion": "0.1.0",
  "overview": {
    "hook": "A woman leaves her entire estate, in a perfectly valid will, 'to my friend Harold absolutely.' Nothing in the document hints that years earlier, in a quiet conversation Harold never wrote down and nobody else witnessed, she asked him to pass most of it on to her estranged daughter after his own death — and he agreed. The will says Harold owns everything outright. Equity may say otherwise. This lesson is about a trust that exists nowhere on paper, resting on nothing but a promise made in private — and about why the law lets that promise bind a man's conscience decades later."
  },
  "lecture": {
    "parts": [
      {
        "partNumber": 1,
        "heading": "A promise the will was never meant to show",
        "voice": "Socratic and atmospheric — sits with the puzzle before offering any resolution",
        "body": [
          "Here is the puzzle this whole lesson circles, and it's worth feeling its full strangeness before you learn how equity resolves it. Parliament decided, in the Wills Act 1837, that a testamentary gift is only valid if it is written down, signed by the testator, and witnessed by two people signing in the testator's presence. The formalities exist for good reason: they guard against fraud, against undue pressure on the dying, against disputes about what a dead person 'really' wanted that can never be resolved because the only witness who could resolve them is gone.",
          "A secret trust asks you to accept something that looks, on its face, like exactly the danger those formalities were built to prevent: a testator's true wishes, recorded nowhere in the will itself, proved only by the oral testimony of the very person who stands to gain — or in a half-secret trust's case, who at least controls — the property. And yet English equity enforces these arrangements. It has done so for over three hundred years. Why would it undermine, in this one context, the exact protection Parliament went to such trouble to build?",
          "Hold that question loosely as you read on, because there isn't a single, agreed answer — this is one of the few doctrines on the syllabus where the leading theoretical explanations genuinely compete, and examiners reward students who can hold both in view rather than picking one and pretending the debate is settled. What's certain is the practical shape of the doctrine; what's contested is why it exists at all. We'll take the shape first, and the theory last, in Part 5 — deliberately, so the theory has real cases to be a theory about."
        ],
        "components": [
          {
            "type": "keyConcept",
            "term": "Secret trust",
            "definition": "A trust of property passing under a will (or on intestacy) whose existence, or whose precise terms, are not disclosed on the face of the will itself, but which equity will enforce against the person who received the property, on proof that they agreed during the testator's lifetime to hold it for someone else."
          }
        ],
        "interaction": {
          "itemId": "equity-06-check-01",
          "type": "quickCheck",
          "skillTag": "understanding",
          "prompt": "A will leaves a house 'to my brother absolutely,' with nothing more said anywhere in the document. If the brother in fact promised the testator, in a private conversation years before, to hold the house for the testator's goddaughter — could equity ever enforce that promise despite the will's silence?",
          "options": [
            "Yes — this is precisely the situation the secret trust doctrine exists to address",
            "No — anything not written into the will itself is legally irrelevant"
          ],
          "correctIndex": 0,
          "feedbackCorrect": "Correct, and this is the doctrine in its purest form: a will that looks like an outright gift, sitting alongside a private promise equity may still enforce against the person named as owner.",
          "feedbackIncorrect": "Not quite — this is exactly the scenario secret trusts address. The will's silence is the point: equity looks past the document to the private arrangement, provided the right elements (which the rest of this lesson sets out) are proved."
        }
      },
      {
        "partNumber": 2,
        "heading": "The fully secret trust: three things to prove",
        "voice": "case-narrative — builds the doctrine directly out of one governing case",
        "body": [
          "A fully secret trust is the starker version of the puzzle: the will discloses nothing at all — not even the existence of a trust. On its face, the recipient simply inherits outright. Ottaway v Norman gives the modern statement of what a claimant must prove to unseat that appearance.",
          "Harry Ottaway told his housekeeper, Eva Hodges, that he wished to leave her his bungalow, its contents, and a sum of money, on the understanding — which she accepted — that she would leave the bungalow to his son William when she herself died. His will left the property to her outright, with no mention of William at all. After Harry died, Eva made a new will leaving the bungalow to someone else entirely. William sued to enforce the secret trust.",
          "Brightman J held that a fully secret trust requires three things, each of which must be proved to the ordinary civil standard: (1) an **intention** by the testator that the recipient should hold the property on trust, not take it beneficially; (2) **communication** of that intention to the recipient, which may happen at any point during the testator's lifetime — before or after the will is made — provided it happens before the testator dies; and (3) **acceptance** by the recipient, which can be express or simply inferred from silent acquiescence once the terms are communicated. On the facts, William succeeded: Eva had clearly understood and accepted the arrangement, and could not defeat it by later changing her own will."
        ],
        "components": [
          {
            "type": "caseCard",
            "caseName": "Ottaway v Norman",
            "citation": "[1972] Ch 698",
            "court": "Chancery Division",
            "year": 1972,
            "factsShort": "A testator left his bungalow to his housekeeper outright by will, having privately obtained her agreement to leave it to his son on her own death; she later tried to leave it elsewhere instead.",
            "ratioShort": "A fully secret trust requires proof of intention, communication to the recipient during the testator's lifetime, and acceptance by the recipient — express or by silent acquiescence.",
            "expanded": {